<?xml version="1.0" encoding="UTF-8"?>
<EntityBean xmlns="http://www.psh.com.cn" xmlns:xsi="http://www.w3.org/2001/XMLSchema-instance"
	xsi:schemaLocation="http://www.psh.com.cn EntityBean.xsd" 
	entityName="nextone.master.bean.StudentBean"
	extendsEntity="nextone.master.bean.BaseEntityBean">
	<entityId>stuId</entityId>
	<pojoNm>Dmt020</pojoNm>
	<bizKey>stuCd</bizKey>
	<sequenceNm>DMT020SQ01</sequenceNm>
	<fields>
		<field  name="stuId">
		    <inputType>HIDDEN</inputType>
			<hidAttributePath>studentBean.stuId</hidAttributePath>
			<hidAttributeId>hidStuId</hidAttributeId>
			<precision>8</precision>
			<scale>0</scale>
		</field>
		<field  name="stuCd">
			<inputType>CODE</inputType>
			<maxlength>20</maxlength>
			<must>true</must>
    		<upperCase>true</upperCase>
    		<labelMsgCd>stuCd</labelMsgCd>
    	</field>
    	<field  name="stuNm">
    		<inputType>TEXT</inputType>
			<maxlength>40</maxlength>
			<must>true</must>
    		<labelMsgCd>stuNm</labelMsgCd>
    	</field>
    	<field  name="stuSex">
    		<inputType>SWITCH</inputType>
			<onValueTransl>1</onValueTransl>
			<offValueTransl>0</offValueTransl>
    		<onText>label.male</onText>
    		<offText>label.female</offText>
    		<labelMsgCd>stuSex</labelMsgCd>
    		<maxlength>20</maxlength>
    	</field>
    	<field  name="stuAge">
    		<inputType>NUM</inputType>
			<maxlength>2</maxlength>
			<must>true</must>
			<precision>8</precision>
			<scale>0</scale>
    		<labelMsgCd>stuAge</labelMsgCd>
    	</field>
    	<field  name="stuMotherLang">
    		<inputType>SELECT</inputType>
			<maxlength>20</maxlength>
			<typeCd>001</typeCd>
    		<labelMsgCd>stuMotherLang</labelMsgCd>
    	</field>
   		<field  name="stuDesc">
   			<inputType>MULTLANG</inputType>
			<maxlength>40</maxlength>
			<must>true</must>
    		<labelMsgCd>stuDesc</labelMsgCd>
    		<nameType>200</nameType>
    		<unique>true</unique>
    	</field>
	</fields>
</EntityBean>